[
  {
    "id": "bio-7a-01",
    "name": "练习使用显微镜",
    "subject": "生物",
    "publisher": "人教版",
    "grade": "七年级上",
    "source": {
      "textbook": "人教版2024",
      "chapter": "1.2.1",
      "pages": [
        14,
        15,
        16
      ],
      "section_type": "实验·探究"
    },
    "purpose": "练习使用光学显微镜，学习规范的操作方法",
    "type": "技能训练",
    "inquiry_method": "按规范步骤操作单目/双目显微镜，对光调光、放置标本、调焦观察",
    "equipment": [
      "显微镜",
      "载玻片",
      "盖玻片",
      "镊子",
      "滴管",
      "擦镜纸"
    ],
    "materials": [
      "动植物玻片标本",
      "池塘水"
    ],
    "functional_components": "显微镜(对光调光、粗/细准焦螺旋调节、物镜切换、放大倍数切换)",
    "steps": [
      {
        "step": "1. 对光调光",
        "substeps": [
          "1.1 转动转换器，使低倍物镜对准通光孔",
          "1.2 调节遮光器，用一个较大的光圈对准通光孔",
          "1.3 一只眼向目镜内看，转动反光镜，看到明亮的圆形视野"
        ]
      },
      {
        "step": "2. 调焦观察",
        "substeps": [
          "2.1 将玻片标本正面朝上放在载物台上，用压片夹压住，移动至通光孔中心",
          "2.2 转动粗准焦螺旋使镜筒缓慢下降（从侧面看，防止物镜与玻片接触）",
          "2.3 一只眼向目镜内看，转动粗准焦螺旋使镜筒缓慢上升，直到看清物像",
          "2.4 略微转动细准焦螺旋，使物像更加清晰"
        ]
      },
      {
        "step": "3. 换高倍镜观察",
        "substeps": [
          "3.1 将观察部位移至视野中央",
          "3.2 转动转换器转换高倍物镜",
          "3.3 用细准焦螺旋调焦"
        ]
      },
      {
        "step": "4. 进一步探究：滴池塘水在载玻片上，盖上盖玻片，观察水中微小生物"
      }
    ],
    "data_recording": "观察并记录不同标本在不同放大倍数下的物像",
    "independent_var": "无",
    "dependent_var": "无",
    "control_group": "无",
    "inquiry_skills": [
      "显微镜规范操作流程（取镜安放、对光、调焦）",
      "放大倍数计算（目镜倍数×物镜倍数）",
      "先低倍后高倍观察原则"
    ],
    "inquiry_openness": {
      "question": "Confirmation",
      "hypothesis": "N/A",
      "experiment_design": "Confirmation",
      "data_analysis": "N/A",
      "conclusion": "Structured"
    },
    "cautions": [
      "不要用手扳镜头来转换物镜",
      "不要用手触摸镜片",
      "转换高倍物镜后切忌用粗准焦螺旋调焦",
      "下降镜筒时眼睛必须从侧面看着物镜",
      "实验完毕将镜筒下降到最低处"
    ],
    "notes": "教材介绍了三种显微镜（单目、双目、数码液晶），核心操作一致；放大倍数=目镜倍数×物镜倍数"
  },
  {
    "id": "bio-7a-02",
    "name": "制作并观察植物细胞临时装片",
    "subject": "生物",
    "publisher": "人教版",
    "grade": "七年级上",
    "source": {
      "textbook": "人教版2024",
      "chapter": "1.2.2",
      "pages": [
        19,
        20,
        21
      ],
      "section_type": "实验·探究"
    },
    "purpose": "制作植物细胞临时装片，认识植物细胞的基本结构，练习画细胞结构简图",
    "type": "观察/探索",
    "inquiry_method": "制作洋葱鳞片叶内表皮等多种植物细胞临时装片，碘液染色后在显微镜下观察并绘图",
    "equipment": [
      "显微镜",
      "载玻片",
      "盖玻片",
      "刀片",
      "镊子",
      "滴管",
      "解剖针",
      "纱布",
      "吸水纸"
    ],
    "materials": [
      "洋葱",
      "番茄",
      "彩椒",
      "黑藻",
      "清水",
      "碘液"
    ],
    "functional_components": "显微镜(调焦、切换放大倍数)、滴管(滴加液体、染色)",
    "steps": [
      {
        "step": "1. 制作洋葱鳞片叶内表皮细胞临时装片",
        "substeps": [
          "1.1 用洁净的纱布将载玻片和盖玻片擦拭干净",
          "1.2 在载玻片中央滴一滴清水",
          "1.3 用镊子从洋葱鳞片叶内侧撕取一小块薄而透明的内表皮，浸入水滴中展平",
          "1.4 用镊子夹起盖玻片，一边先接触水滴，然后缓缓放下（避免气泡）",
          "1.5 在盖玻片一侧滴1-2滴碘液，用吸水纸从另一侧吸引"
        ]
      },
      {
        "step": "2. 尝试制作其他植物细胞临时装片",
        "substeps": [
          "2.1 彩椒外表皮：取果皮刮去果肉，取最薄部分制片",
          "2.2 黑藻叶片：直接取一片幼嫩小叶制片",
          "2.3 番茄果肉：用解剖针挑取少许成熟果肉涂在水滴中"
        ]
      },
      {
        "step": "3. 在低倍镜下观察，辨认细胞各种结构"
      },
      {
        "step": "4. 练习画细胞结构简图"
      }
    ],
    "data_recording": "绘制植物细胞结构简图，标注细胞壁、细胞膜、细胞质、细胞核、液泡、叶绿体等",
    "independent_var": "无",
    "dependent_var": "无",
    "control_group": "无",
    "inquiry_skills": [
      "临时装片制作技术（擦→滴→取→展→盖→染）",
      "碘液染色法（一侧滴碘液、另一侧用吸水纸吸引）",
      "盖盖玻片防气泡技术（一边先接触水滴再缓缓放下）",
      "生物绘图规范（铅笔画图、暗处用细点表示）"
    ],
    "inquiry_openness": {
      "question": "Confirmation",
      "hypothesis": "N/A",
      "experiment_design": "Confirmation",
      "data_analysis": "Guided",
      "conclusion": "Guided"
    },
    "cautions": [
      "盖盖玻片时一边先接触水滴再缓缓放下",
      "撕取的表皮要薄而透明",
      "碘液从一侧滴、另一侧吸引",
      "画图用铅笔，暗处用细点表示"
    ],
    "notes": "涉及4种不同植物材料，取材方法各异（撕、刮、取叶、挑取）"
  },
  {
    "id": "bio-7a-03",
    "name": "观察人的口腔上皮细胞和动物细胞",
    "subject": "生物",
    "publisher": "人教版",
    "grade": "七年级上",
    "source": {
      "textbook": "人教版2024",
      "chapter": "1.2.3",
      "pages": [
        23,
        24,
        25
      ],
      "section_type": "实验·探究"
    },
    "purpose": "制作并观察人的口腔上皮细胞临时装片，观察动物细胞永久标本，认识动物细胞基本结构",
    "type": "观察/探索",
    "inquiry_method": "用无菌牙签刮取口腔上皮细胞制作临时装片，碘液染色后显微镜观察，并比较动植物细胞异同",
    "equipment": [
      "显微镜",
      "载玻片",
      "盖玻片",
      "镊子",
      "滴管",
      "纱布",
      "吸水纸"
    ],
    "materials": [
      "动物细胞永久玻片标本",
      "生理盐水",
      "碘液",
      "无菌牙签"
    ],
    "functional_components": "显微镜(调焦、切换放大倍数)、滴管(滴加液体、染色)",
    "steps": [
      {
        "step": "1. 制作人的口腔上皮细胞临时装片",
        "substeps": [
          "1.1 将载玻片、盖玻片擦拭干净",
          "1.2 在载玻片中央滴一滴生理盐水",
          "1.3 漱口后，用无菌牙签在口腔内壁上轻刮几下",
          "1.4 把牙签附有碎屑的一端放在生理盐水中轻轻涂抹",
          "1.5 盖上盖玻片（一边先接触水滴），碘液染色"
        ]
      },
      {
        "step": "2. 显微镜观察人的口腔上皮细胞"
      },
      {
        "step": "3. 观察动物细胞永久玻片标本"
      },
      {
        "step": "4. 绘制动物细胞结构简图并标注"
      }
    ],
    "data_recording": "绘制动物细胞结构简图，标注细胞膜、细胞质、细胞核",
    "independent_var": "无",
    "dependent_var": "无",
    "control_group": "无",
    "inquiry_skills": [
      "生理盐水维持细胞正常形态（不能用清水，否则细胞吸水变形）",
      "临时装片制作技术",
      "碘液染色法"
    ],
    "inquiry_openness": {
      "question": "Confirmation",
      "hypothesis": "N/A",
      "experiment_design": "Confirmation",
      "data_analysis": "Guided",
      "conclusion": "Guided"
    },
    "cautions": [
      "制作前先漱口",
      "使用无菌牙签",
      "必须使用生理盐水而非清水（维持细胞正常形态）"
    ],
    "notes": "通过与植物细胞对比，引导学生认识动物细胞没有细胞壁、叶绿体，通常也没有液泡"
  },
  {
    "id": "bio-7a-04",
    "name": "观察人体的基本组织",
    "subject": "生物",
    "publisher": "人教版",
    "grade": "七年级上",
    "source": {
      "textbook": "人教版2024",
      "chapter": "1.3.2",
      "pages": [
        40
      ],
      "section_type": "实验·探究"
    },
    "purpose": "观察人体四种基本组织的永久玻片标本，认识上皮组织、肌肉组织、结缔组织、神经组织",
    "type": "观察/探索",
    "inquiry_method": "用显微镜先低倍镜观察细胞排列、再高倍镜观察细胞形态，比较四种组织",
    "equipment": [
      "显微镜"
    ],
    "materials": [
      "人体四种基本组织的永久玻片标本"
    ],
    "functional_components": "显微镜(调焦、低倍/高倍切换)",
    "steps": [
      {
        "step": "1. 在低倍镜下观察组织细胞，移动玻片了解排列情况"
      },
      {
        "step": "2. 使用高倍镜仔细观察组织细胞的形态特点"
      },
      {
        "step": "3. 比较四种组织在细胞排列和形态方面的异同"
      }
    ],
    "data_recording": "记录四种组织的细胞排列特点和形态特征",
    "independent_var": "无",
    "dependent_var": "无",
    "control_group": "无",
    "inquiry_skills": [
      "显微镜操作（先低倍后高倍观察法）"
    ],
    "inquiry_openness": {
      "question": "Confirmation",
      "hypothesis": "N/A",
      "experiment_design": "Confirmation",
      "data_analysis": "Guided",
      "conclusion": "Guided"
    },
    "cautions": [],
    "notes": "四种基本组织：上皮组织（保护、分泌）、肌肉组织（收缩舒张）、结缔组织（支持、连接、保护、营养）、神经组织（感受刺激、传导神经冲动）"
  },
  {
    "id": "bio-7a-05",
    "name": "观察草履虫并探究其趋性",
    "subject": "生物",
    "publisher": "人教版",
    "grade": "七年级上",
    "source": {
      "textbook": "人教版2024",
      "chapter": "1.3.4",
      "pages": [
        47,
        48
      ],
      "section_type": "实验·探究"
    },
    "purpose": "观察草履虫的形态及运动，探究草履虫对不同刺激的趋性反应",
    "type": "调参/验证",
    "inquiry_method": "从培养液中取样观察草履虫形态，设置不同刺激源（肉汁、食盐等）探究趋性",
    "equipment": [
      "显微镜",
      "放大镜",
      "载玻片",
      "盖玻片",
      "滴管"
    ],
    "materials": [
      "草履虫培养液",
      "肉汁",
      "清水",
      "食盐粒",
      "棉花纤维",
      "牙签"
    ],
    "functional_components": "显微镜(观察草履虫形态)、放大镜(放大观察运动方向)",
    "steps": [
      {
        "step": "1. 观察草履虫的形态及运动",
        "substeps": [
          "1.1 从培养液表层吸取一滴，滴在载玻片上",
          "1.2 用肉眼和放大镜观察草履虫",
          "1.3 盖上盖玻片，低倍镜下观察形态和运动",
          "1.4 如运动过快，可先放几丝棉花纤维再盖盖玻片"
        ]
      },
      {
        "step": "2. 探究草履虫的趋性",
        "substeps": [
          "2.1 在载玻片两端各滴一滴培养液，用牙签在两液滴间轻划使之连通",
          "2.2 用放大镜观察草履虫的运动",
          "2.3 在右侧培养液边缘滴一滴肉汁，观察运动方向",
          "2.4 自行设计实验探究草履虫对食盐粒、清水等不同刺激的反应"
        ]
      }
    ],
    "data_recording": "记录草履虫在不同刺激源下的运动方向和行为",
    "independent_var": "1个(刺激物类型: 肉汁 vs 食盐粒 vs 清水)",
    "dependent_var": "1个 定性(草履虫的运动方向: 趋向/远离)",
    "control_group": "有 未添加刺激物的一端作为对照",
    "inquiry_skills": [
      "控制变量法（单一变量原则）",
      "对照实验设计",
      "棉花纤维限速法（减缓草履虫运动速度以便观察）"
    ],
    "inquiry_openness": {
      "question": "Structured",
      "hypothesis": "Guided",
      "experiment_design": "Guided",
      "data_analysis": "Guided",
      "conclusion": "Guided"
    },
    "cautions": [
      "食盐粒等刺激物放在培养液边缘",
      "各实验组除刺激源不同外其他条件保持一致"
    ],
    "notes": "兼具观察和探究两层面：Part1观察形态运动，Part2有控制变量的探究实验"
  },
  {
    "id": "bio-7a-06",
    "name": "观察种子的结构",
    "subject": "生物",
    "publisher": "人教版",
    "grade": "七年级上",
    "source": {
      "textbook": "人教版2024",
      "chapter": "2.1.2",
      "pages": [
        65,
        66,
        67
      ],
      "section_type": "实验·探究"
    },
    "purpose": "认识种子的结构，比较菜豆和玉米种子的异同",
    "type": "观察/探索",
    "inquiry_method": "解剖浸软的菜豆种子和玉米种子，观察并比较各部分结构",
    "equipment": [
      "刀片",
      "滴管",
      "放大镜"
    ],
    "materials": [
      "浸软的菜豆种子",
      "浸软的玉米种子",
      "碘液"
    ],
    "functional_components": "放大镜(观察胚的结构细节)",
    "steps": [
      {
        "step": "1. 观察菜豆种子的结构",
        "substeps": [
          "1.1 取一粒浸软的菜豆种子，观察外形",
          "1.2 剥去种皮，分开两片子叶",
          "1.3 用放大镜观察子叶、胚根、胚芽和胚轴"
        ]
      },
      {
        "step": "2. 观察玉米种子的结构",
        "substeps": [
          "2.1 取一粒浸软的玉米种子，观察外形",
          "2.2 用刀片从中央纵向剖开",
          "2.3 观察果皮和种皮、胚乳、胚根、胚芽、胚轴、子叶",
          "2.4 在剖面上滴碘液，观察哪些部分被染成蓝色"
        ]
      }
    ],
    "data_recording": "记录菜豆和玉米种子各部分结构的异同，完成对比表格",
    "independent_var": "无",
    "dependent_var": "无",
    "control_group": "无",
    "inquiry_skills": [
      "淀粉遇碘变蓝（碘液检测淀粉）",
      "纵切解剖法"
    ],
    "inquiry_openness": {
      "question": "Confirmation",
      "hypothesis": "N/A",
      "experiment_design": "Confirmation",
      "data_analysis": "Structured",